{
  "schemaVersion": 1,
  "level": "L1",
  "baseline": "12b9a093cb991e33e0bb4bf495acbc32f61bca88",
  "changedFeatures": [
    "first-internal-testflight-ui9-validation"
  ],
  "environments": [
    "dev"
  ],
  "redesign": false,
  "foundationRerun": false,
  "floorOverrides": [],
  "release": {
    "markets": [
      "service"
    ],
    "until": "public"
  }
}
