{
  "schemaVersion": 1,
  "level": "L1",
  "baseline": "fd7316763294746d2f65356babad4f77654447fc",
  "changedFeatures": [
    "first-internal-testflight-ui10-validation"
  ],
  "environments": [
    "dev"
  ],
  "redesign": false,
  "foundationRerun": false,
  "floorOverrides": [],
  "release": {
    "markets": [
      "service"
    ],
    "until": "public"
  }
}
