{
  "schemaVersion": 1,
  "level": "L1",
  "baseline": "4e2d7b5d49251d91ac7770b306b355298a8a61ef",
  "changedFeatures": [
    "first-internal-testflight-ui8-validation"
  ],
  "environments": [
    "dev"
  ],
  "redesign": false,
  "foundationRerun": false,
  "floorOverrides": [],
  "release": {
    "markets": [
      "service"
    ],
    "until": "public"
  }
}
