{
  "schemaVersion": 1,
  "level": "L1",
  "baseline": "b1353afe152a72c3d609bd03bb9486182cf58106",
  "changedFeatures": [
    "first-internal-cloud12-exact-recovery"
  ],
  "environments": [
    "dev"
  ],
  "redesign": false,
  "foundationRerun": false,
  "floorOverrides": [],
  "release": {
    "markets": [
      "service"
    ],
    "until": "public"
  }
}
