{
  "schemaVersion": 1,
  "level": "L1",
  "baseline": "a2da27879d58da7f6e018be530162cb20e6273a1",
  "changedFeatures": [
    "google-play-promotion"
  ],
  "environments": [
    "dev"
  ],
  "redesign": false,
  "foundationRerun": false,
  "floorOverrides": [],
  "release": {
    "markets": [
      "service"
    ],
    "until": "public"
  }
}
