{
  "schemaVersion": 1,
  "level": "L1",
  "baseline": "c078a9a18de848e5f0e834e04bfa2fac4f3a6ede",
  "changedFeatures": [
    "first-internal-apple-provider-relation-read"
  ],
  "environments": [
    "dev"
  ],
  "redesign": false,
  "foundationRerun": false,
  "floorOverrides": [],
  "release": {
    "markets": [
      "service"
    ],
    "until": "public"
  }
}
