{
  "schemaVersion": 1,
  "level": "L1",
  "baseline": "1f3780179c7d1d5fb60a97b9688f2076f22e5205",
  "changedFeatures": [
    "apps-in-toss-deployment"
  ],
  "environments": [
    "dev"
  ],
  "redesign": false,
  "foundationRerun": false,
  "floorOverrides": [],
  "release": {
    "markets": [
      "service"
    ],
    "until": "public"
  }
}
