{
  "schemaVersion": 1,
  "level": "L1",
  "baseline": "66c19b82355a2883f5a6d12890919a332dd4baee",
  "changedFeatures": [
    "historical-review-coverage"
  ],
  "environments": [
    "dev"
  ],
  "redesign": false,
  "foundationRerun": false,
  "floorOverrides": [],
  "release": {
    "markets": [
      "service"
    ],
    "until": "public"
  }
}
