{
  "schemaVersion": 1,
  "level": "L1",
  "baseline": "1e2710983bff98ef1062c7fd7d920bd2bec4eb0f",
  "changedFeatures": [
    "first-internal-testflight-ui6-validation"
  ],
  "environments": [
    "dev"
  ],
  "redesign": false,
  "foundationRerun": false,
  "floorOverrides": [],
  "release": {
    "markets": [
      "service"
    ],
    "until": "public"
  }
}
