{
  "schemaVersion": 1,
  "level": "L1",
  "baseline": "246e9c7ded7e8ab8416e26318464228142cd4100",
  "changedFeatures": ["development-evidence"],
  "environments": ["dev"],
  "redesign": false,
  "foundationRerun": false,
  "floorOverrides": [],
  "release": {"markets": ["service"], "until": "public"}
}
